{
  "$schema": "./tecton.map.schema.json",
  "version": 2,
  "meta": {
    "dataSource": "generated-css-export",
    "nameReconstructed": false,
    "note": "src/styles/tecton-tokens.css is the generated CSS export of the Tecton design system (light + dark). Every shadcn variable references a Tecton token in both modes; `light` defaults to the same token as `dark`."
  },
  "shadcn": {
    "background": {
      "dark": "--tecton-color-bg-default",
      "confidence": "exact",
      "note": "App/page background."
    },
    "foreground": {
      "dark": "--tecton-color-text-primary",
      "confidence": "exact",
      "note": "Default product UI text."
    },
    "card": {
      "dark": "--tecton-color-bg-paper",
      "confidence": "exact",
      "note": "Paper surface (cards, panels, docks)."
    },
    "card-foreground": {
      "dark": "--tecton-color-text-primary",
      "confidence": "exact",
      "note": "Tecton has no card-specific text token; text-primary is used on every surface."
    },
    "popover": {
      "dark": "--tecton-color-bg-paper",
      "confidence": "exact",
      "note": "Surface of every floating panel: dialogs, popovers (and the date picker in one), hover cards, dropdown and context menus, select and combobox lists. Paper, as Tecton MUI menus; tooltips use `tooltip`."
    },
    "popover-foreground": {
      "dark": "--tecton-color-text-primary",
      "confidence": "exact",
      "note": "See card-foreground."
    },
    "primary": {
      "dark": "--tecton-color-action-primary-bg",
      "confidence": "exact",
      "note": "Filled primary action surface."
    },
    "primary-foreground": {
      "dark": "--tecton-color-action-primary-text",
      "confidence": "exact",
      "note": "Text on the primary action surface (Tecton switches to #ffffff on hover; Vega uses primary/80 instead)."
    },
    "secondary": {
      "dark": "--tecton-color-action-secondary-bg",
      "confidence": "exact",
      "note": "Filled secondary action surface."
    },
    "secondary-foreground": {
      "dark": "--tecton-color-action-secondary-text",
      "confidence": "exact",
      "note": "Text on the secondary action surface."
    },
    "muted": {
      "dark": "--tecton-color-input-filled-bg",
      "confidence": "approximated",
      "note": "Tecton has no generic 'muted surface'; the filled-input background (also the table footer) is the closest subdued surface."
    },
    "muted-foreground": {
      "dark": "--tecton-color-text-secondary",
      "confidence": "exact",
      "note": "Secondary labels, descriptions and metadata."
    },
    "accent": {
      "dark": "--tecton-color-action-tertiary-bg-hover",
      "confidence": "approximated",
      "note": "shadcn uses accent for hover/selected rows and ghost hover; Tecton's tertiary hover surface (same as the table hover row) plays that role."
    },
    "accent-foreground": {
      "dark": "--tecton-color-text-primary",
      "confidence": "exact",
      "note": "Text on hovered/selected surfaces."
    },
    "destructive": {
      "dark": "--tecton-color-status-error",
      "confidence": "exact",
      "note": "Error status main colour; shadcn draws destructive text on background and destructive buttons with destructive/10."
    },
    "border": {
      "dark": "--tecton-color-divider",
      "confidence": "exact",
      "note": "Default divider/border."
    },
    "input": {
      "dark": "--tecton-color-input-outlined-border-hover",
      "confidence": "approximated",
      "note": "Outlined input border. Uses Tecton's hovered value as the resting one so the border does not change under the pointer; the field keeps a steadier outline at the cost of its hover affordance, and focus / invalid still recolour it."
    },
    "ring": {
      "dark": "--tecton-color-focus-ring",
      "confidence": "exact",
      "note": "Keyboard focus outline. Vega renders it as ring-3 ring-ring/50; Tecton draws a solid 2px ring."
    },
    "chart-1": {
      "dark": "--tecton-color-accent-azure-fill",
      "confidence": "approximated",
      "note": "Chart series colours are chosen from the 7 Tecton accents in the order used by the Cost-vs-Risk panel."
    },
    "chart-2": {
      "dark": "--tecton-color-accent-saffron-fill",
      "confidence": "approximated",
      "note": "See chart-1."
    },
    "chart-3": {
      "dark": "--tecton-color-accent-lime-fill",
      "confidence": "approximated",
      "note": "See chart-1."
    },
    "chart-4": {
      "dark": "--tecton-color-accent-blue-fill",
      "confidence": "approximated",
      "note": "See chart-1."
    },
    "chart-5": {
      "dark": "--tecton-color-accent-pink-fill",
      "confidence": "approximated",
      "note": "See chart-1."
    },
    "sidebar": {
      "dark": "--tecton-color-bg-paper",
      "confidence": "exact",
      "note": "Sidebar sits on the paper surface, like Tecton's side panels."
    },
    "sidebar-foreground": {
      "dark": "--tecton-color-text-primary",
      "confidence": "exact",
      "note": ""
    },
    "sidebar-primary": {
      "dark": "--tecton-color-action-primary-bg",
      "confidence": "exact",
      "note": ""
    },
    "sidebar-primary-foreground": {
      "dark": "--tecton-color-action-primary-text",
      "confidence": "exact",
      "note": ""
    },
    "sidebar-accent": {
      "dark": "--tecton-color-content-bg-hover",
      "confidence": "exact",
      "note": "Hovered sidebar item: Tecton's content (list item) hover surface, as the Tecton MUI list item button. Pressed and current items use `content-pressed` / `content-active`."
    },
    "sidebar-accent-foreground": {
      "dark": "--tecton-color-text-primary",
      "confidence": "exact",
      "note": ""
    },
    "sidebar-border": {
      "dark": "--tecton-color-divider-subtle",
      "confidence": "exact",
      "note": "Low-emphasis separator inside panels."
    },
    "sidebar-ring": {
      "dark": "--tecton-color-focus-ring",
      "confidence": "exact",
      "note": ""
    },
    "radius": {
      "dark": "--tecton-radius-50",
      "confidence": "exact",
      "note": "Default Tecton corner radius (4px). Non-colour, declared in :root only."
    }
  },
  "extra": {
    "success": {
      "dark": "--tecton-color-status-success",
      "confidence": "exact",
      "note": "Status success main colour: text, borders and icons (alert/badge outline and default appearance) and a solid surface with `success-foreground`."
    },
    "success-foreground": {
      "dark": "--tecton-color-status-success-filled-text",
      "confidence": "exact",
      "note": "Text on a `success` surface."
    },
    "warning": {
      "dark": "--tecton-color-status-warning",
      "confidence": "exact",
      "note": "Status warning main colour: text, borders and icons (alert/badge outline and default appearance) and a solid surface with `warning-foreground`."
    },
    "warning-foreground": {
      "dark": "--tecton-color-text-inverse",
      "confidence": "approximated",
      "note": "Text on a `warning` surface: Tecton's filled-text is meant for the pale `warning-surface`, so the inverse text colour is used on the main colour."
    },
    "info": {
      "dark": "--tecton-color-status-info",
      "confidence": "exact",
      "note": "Status info main colour: text, borders and icons (alert/badge outline and default appearance) and a solid surface with `info-foreground`."
    },
    "info-foreground": {
      "dark": "--tecton-color-status-info-filled-text",
      "confidence": "exact",
      "note": "Text on an `info` surface."
    },
    "neutral": {
      "dark": "--tecton-color-status-neutral",
      "confidence": "exact",
      "note": "Status neutral main colour: text, borders and icons (alert/badge outline and default appearance) and a solid surface with `neutral-foreground`."
    },
    "neutral-foreground": {
      "dark": "--tecton-color-text-inverse",
      "confidence": "approximated",
      "note": "Text on a `neutral` surface (Tecton's filled-text is meant for the `neutral-surface`)."
    },
    "destructive-foreground": {
      "dark": "--tecton-color-status-error-filled-text",
      "confidence": "exact",
      "note": "Text on the filled error surface. shadcn v4 dropped this token; Tecton restores it for filled error chips/alerts."
    },
    "success-surface": {
      "dark": "--tecton-color-status-success-filled-bg",
      "confidence": "exact",
      "note": "Tecton's filled success surface (alert and badge `appearance=\"filled\"` / solid)."
    },
    "success-surface-foreground": {
      "dark": "--tecton-color-status-success-filled-text",
      "confidence": "exact",
      "note": "Text on `success-surface`."
    },
    "warning-surface": {
      "dark": "--tecton-color-status-warning-filled-bg",
      "confidence": "exact",
      "note": "Tecton's filled warning surface (alert and badge `appearance=\"filled\"` / solid)."
    },
    "warning-surface-foreground": {
      "dark": "--tecton-color-status-warning-filled-text",
      "confidence": "exact",
      "note": "Text on `warning-surface`."
    },
    "info-surface": {
      "dark": "--tecton-color-status-info-filled-bg",
      "confidence": "exact",
      "note": "Tecton's filled info surface (alert and badge `appearance=\"filled\"` / solid)."
    },
    "info-surface-foreground": {
      "dark": "--tecton-color-status-info-filled-text",
      "confidence": "exact",
      "note": "Text on `info-surface`."
    },
    "neutral-surface": {
      "dark": "--tecton-color-status-neutral-filled-bg",
      "confidence": "exact",
      "note": "Tecton's filled neutral surface (alert and badge `appearance=\"filled\"` / solid)."
    },
    "neutral-surface-foreground": {
      "dark": "--tecton-color-status-neutral-filled-text",
      "confidence": "exact",
      "note": "Text on `neutral-surface`."
    },
    "destructive-surface": {
      "dark": "--tecton-color-status-error-filled-bg",
      "confidence": "exact",